Company,Executive,Title,Since,Notes,Updated,undergraduate_years,undergraduate_institute,undergraduate_major,undergraduate_minor,undergraduate_degree,undergraduate_note,master_years,master_institute,master_major,master_minor,master_degree,master_note,phd_years,phd_institute,phd_major,phd_minor,phd_degree,phd_note
Accenture,Julie Sweet,CEO[1],2019,"Succeeded Pierre Nanterme, died",2019/01/31,1985-1989,Claremont McKenna College,International Relations,,BA,Activities and Societies: Debate team; spent one year abroad studying Chinese in Taiwan and Taipei Language Institute and in Beijing at Peking University (Beida),1990-1992,Columbia Law School,Law,,JD,,,,,,,
Aditya Birla Group,Kumar Mangalam Birla,Chairman[2],1995[2],Part of the Birla family business house in India,2018/10/01,,University of Mumbai,,,Bcom,,,London Business School,,,MBA,,,,,,,
Adobe Systems,Shantanu Narayen,"Chairman, president and CEO[3]",2007,Formerly with Apple Inc.,2018/10/01,,Osmania University,electronics and communication engineering,,BE,,????-1986:::????-1993,"Bowling Green State University:::University of California, Berkeley",,,MS:::MBA,,,,,,,
Agenus,Garo H. Armen,"Founder, chairman, CEO[4]",1994,Founder of the Children of Armenia Fund (COAF),2018/10/01,,,,,,,,,,,,,????-1979,City University of New York,physical chemistry,,PhD,
Airbus,Guillaume Faury,CEO[5],2012,Succeeded Louis Gallois,2017/11/14,1987 – 1990,École Polytechnique,Physique,,Diplôme d'ingénieur,,1990-1992:::1998-2000,ISAE-SUPAERO:::Aix-Marseille Graduate School of Management - IAE,"Science et technologie aéronautique / aérospatiale / aviation, général:::Administration des entreprises",,Diplôme d'ingénieur:::DESS,,,,,,,
Alibaba,Daniel Zhang,CEO[6],2015,Previously with Taobao,2018/10/01,,Shanghai University of Finance and Economics,finance,,,,,,,,,,,,,,,
Amazon.com,Jeff Bezos,"Founder, President, CEO and chairman[7]",1994,Founder of the firm and one of the world's wealthiest people,2018/10/01,,Princeton University,"electrical engineering, computer science",,"BSE, EECS","In 1986, he graduated summa cum laude from Princeton University with a 4.2 GPA and a Bachelor of Science in Engineering degree (B.S.E.) in electrical engineering and computer science; he was also a member of Phi Beta Kappa. While at Princeton, Bezos was a member of the Quadrangle Club, one of Princeton's 11 eating clubs. In addition, he was elected to Tau Beta Pi and was the president of the Princeton chapter of the Students for the Exploration and Development of Space (SEDS).",,,,,,,,,,,,
Advanced Micro Devices,Lisa Su,CEO and president[8],2014,Formerly with Texas Instruments,2018/10/01,1986-1991,MIT,Electrical Engineering,,BS/MS,"Activities and Societies: VI-A program, UROP program, Eta Kappa Nu",1986-1991,MIT,Electrical Engineering,,BS/MS,"Activities and Societies: VI-A program, UROP program, Eta Kappa Nu",1990-1994,MIT,Electrical Engineering,,PhD,"Activities and Societies: Semiconductor device physics and integration, Silicon-on-Insulator devices (Area V)"
American Express,Stephen Squeri,Chairman and CEO[9],2018,Former vice chairman of American Express since 2015,2018/10/01,????-1981,Manhattan College,,,BA,,????-1986,Manhattan College,,,MBA,,,,,,,
American Airlines Group,Doug Parker,Chairman and CEO[10],2013,Previously CEO for US Airways,2018/10/01,????-1984,Albion College,Economics,,BA,,????-1986,Vanderbilt University,Finance,,MBA,,,,,,,
Anthem Inc.,Joseph R. Swedish,"Chairman, president and CEO[11]",2013,"Previously with Centura Health and Trinity Health (Livonia, Michigan)",2018/10/01,,University of North Carolina at Charlotte,Political Science,,BA,,,Duke University,,,Master of Health Administration,,,,,,,
Apple Inc.,Tim Cook,CEO[12],2011,Replaced Steve Jobs,2018/10/01,????-1982,Auburn University,Industrial engineering,,BS,,????-1988,Duke University,,,MBA,,,,,,,
Arcelor Mittal,Lakshmi Niwas Mittal,Chairman and CEO[13],2006,Owner of Queens Park Rangers F.C.,2018/10/01,,"St. Xavier's College, affiliated to the University of Calcutta",,,B.Com,,,,,,,,,,,,,
AT&T,John Stankey,CEO[14],2020,Former CEO of WarnerMedia,2020/11/19,????-1985,Loyola Marymount University,Finance,,B.B.A.,,????-1991,UCLA,,,MBA,,,,,,,
BAE Systems,Charles Woodburn,Chief Executive Officer[15],2008,Succeeded Ian King,2018/10/01,1989-1992,University of Cambridge,Physics & Electrical Engineering (EIST),,BA/MA,Activities and Societies: St. John's College; First Class Honours,2003-2005,RSM Erasmus Universiteit,,,MBA,Schlumberger in-company MBA (part-time),1992 – 1995,University of Cambridge,Electrical Engineering,,PhD,Activities and Societies: St. John's College
Bajaj Allianz General Insurance,Tapan Singhel,MD and CEO[16],2012,President of the Indo-German Chamber of Commerce,2018/10/01,,,,,,,1988-1990,Banaras Hindu University,Physics,,M.Sc.,M.Sc. with specialisation in spectroscopy and lasers,,,,,,
Banco Bilbao Vizcaya Argentaria,Carlos Torres Vila,Chairman and CEO[17],2015,Previously with Endesa,2018/10/01,1984-1988,MIT,"Electrical Engineering, Management",,BS,,1989-1990:::1984-1994,MIT:::Universidad Nacional de Educación a Distancia - U.N.E.D.,Management:::Law,,MSc:::Licenciado,,,,,,,
Bank of America,Brian Moynihan,Chairman and CEO[18],2009,Previously with FleetBoston Financial until it merged with BOA,2018/10/01,????-1981,Brown University,history,,BA,"co-captained the rugby team, and met his future wife, classmate Susan E. Berry",,University of Notre Dame Law School,,,JD,,,,,,,
Barclays,Jes Staley,Group Chief Executive[19],2015,Succeeded Antony Jenkins,2018/10/01,,Bowdoin College,economics,,BA,graduated cum laude,,,,,,,,,,,,
Berkshire Hathaway,Warren Buffett,Chairman and CEO,1970,One of the world's wealthiest people,2018/10/01,,University of Nebraska,Business Administration,,BS,"In 1947, Buffett entered the Wharton School of the University of Pennsylvania. He would have preferred to focus on his business ventures, but his father pressured him to enroll. Warren studied there for two years and joined the Alpha Sigma Phi fraternity.",????-1951,Columbia University,Economics,,MS,,,,,,,
Best Buy,Hubert Joly,Chairman and CEO[20],2012,Previously CEO of CWT,2018/10/01,1978-1981,HEC Paris,,,BA,,1981-1983,Institut d'Etudes politiques de Paris,Economics,,PA,,,,,,,
Bharti Enterprises,Sunil Bharti Mittal,Founder and chairman[21],1985,Founder of the firm,2018/10/01,,,,,,,,,,,,,,,,,,
Blackstone Group,Stephen A. Schwarzman,"Chairman, CEO and co-founder[22]",1985,Co-founded the firm with Peter George Peterson,2017/11/15,????-1969,Yale University,,,BA,,????-1972,Harvard Business School,,,MBA,,,,,,,
BHP Billiton,Andrew Mackenzie,CEO[23],2013,Previously with BP and the Rio Tinto Group,2017/11/15,????-1977,University of St Andrews,geology,,BSc,,,,,,,,????-1981,University of Bristol,organic chemistry,,PhD,
BMW,Oliver Zipse,Chairman of the board of management[24],2020,Succeeded Harald Krüger,2017/11/15,1985-1991,Technische Universität Darmstadt,mechanical engineering,,Dipl.-Ing.,He studied computer science and mathematics at the University of Utah in Salt Lake City from 1983 to 1985 without obtaining a degree,????-1999,,,,EMBA,"Kellogg-WHU Executive MBA Program which is a joint MBA degree from Kellogg School of Management, USA and WHU – Otto Beisheim School of Management, Germany",,,,,,
Boeing,Dave Calhoun,"Chairman, president and CEO[25]",2020,Succeeded Dennis Muilenburg in the aftermath of 737 Max crisis.,2015-2020,,Virginia Tech,accounting,,,,,,,,,,,,,,,
Boston Consulting Group,Rich Lesser,President and CEO[26],2013,Replaced Hans-Paul Bürkner,2017/11/15,,University of Michigan,Chemical Engineering,,BS,Activities and Societies: Tau Beta Pi; Summa cum laude,,Harvard Business School,,,MBA,"Baker Scholar, High Distinction",,,,,,
BP,Bob Dudley,Group Chief Executive[27],2010,Previously led TNK-BP,2017/11/15,,University of Illinois,chemical engineering,,,he joined the fraternity Phi Kappa Psi and served as District 3 Archon,,Thunderbird School of Global Management:::Southern Methodist University,international management,,MIM:::MBA,Thunderbird School of Global Management (now part of Arizona State University),,,,,,
Campbell Soup Company,Denise Morrison,President and CEO[28],2011,12th leader of the company,2017/11/14,,Boston College,"economics, psychology",,BS,magna cum laude; inducted into the Order of the Cross and Crown Honor Society for academic and extracurricular achievement,,,,,,,,,,,,
Canonical Ltd.,Mark Shuttleworth,Founder and CEO[29],2017,Stepped down as CEO in 2009 and resumed in 2017,2017/11/14,1992-1995,University of Cape Town,"Finance, Information Systems",,Bachelor of Business Science,,,,,,,,,,,,,
Capgemini,Paul Hermelin,Chairman and CEO[30],2012,Previously a member of the French government,2017/11/14,1972-1975,Ecole Polytechnique,,,,,1976-1978,ENA - Ecole nationale d'administration,Économie,,,,,,,,,
Capital One Financial,Richard Fairbank,"Founder, chairman and CEO[31]",1988,Co-founded the firm with Nigel Morris,2017/11/14,????-1972,Stanford University,economics,,,enrolled at Pomona College before transferring to Stanford University,????-1981,Stanford Graduate School of Business,,,MBA,"graduated first in his class, as well as receiving the excellence in leadership award from the University in 2006",,,,,,
Caterpillar Inc.,Jim Umpleby,CEO[32],2017,Succeeded Douglas R. Oberhelman,2017/11/14,????-1980,Rose-Hulman Institute of Technology,Mechanical Engineering,,BS,,,,,,,,,,,,,
Chubb Limited,Evan G. Greenberg,Chairman and CEO[33],2004,Former COO of American International Group,2018/10/01,,,,,,"attended New York University and the College of Insurance (now part of St. John's University, New York) but did not graduate from either",,,,,,,,,,,,
Cisco Systems,Chuck Robbins,CEO[34],2015,"Succeeded John T. Chambers, who became the chairman",2017/11/14,1983-1987,University of North Carolina at Chapel Hill,Mathematical Sciences,,BS,,,,,,,,,,,,,
Citigroup,Michael Corbat,CEO[35],2012,Succeeded Vikram Pandit,2017/11/14,,Harvard University,economics,,BA,,,,,,,,,,,,,
Coca-Cola,James Quincey,Chairman and CEO[36],2008,Previously the firm's COO,2017/11/14,,University of Liverpool,electronic engineering,,BSc,,,,,,,,,,,,,
Cognizant,Brian Humphries,CEO[37],2019,Succeeded co-founder Francisco D'Souza,2017/11/14,1991-1996,University of Ulster,,,B.B.A.,Honors,,,,,,,,,,,,
Comcast,Brian L. Roberts,Chairman and CEO[38],2002,"Son of Ralph J. Roberts, the founder of Comcast",2017/11/14,,University of Pennsylvania,,,BS,,,,,,,,,,,,,
Credit Suisse,Tidjane Thiam,CEO[39],2015,Formerly with Prudential,2017/11/14,,,,,,,????-1988,INSEAD,,,MBA,Dean's list,,,,,,
Crown Worldwide Group,James E. Thompson,Chairman and founder[40],1965,Founder of the firm,2017/11/14,,San Jose State University,aeronautical engineering,,BS,brother of Alpha Tau Omega (Epsilon Chi Chapter).,,,,,,,,,,,,
Daimler AG,Ola Källenius,Chairman of the board of management[41],2019,Also head of Mercedes-Benz,2020/08/08,,,,,,,,,,,,,,,,,,
Dell,Michael Dell,Chairman and CEO[42],1984,Founder of the firm,2017/11/14,,,,,,dropped out of the University of Texas (where he took up pre-med) at age 19,,,,,,,,,,,,
Deutsche Bank,Christian Sewing,CEO,2018,"Former head of private and commercial banking at Deutsche Bank, replaced John Cryan",2018/12/19,,Frankfurt School of Finance & Management,business administration,,,,,,,,,,,,,,,
Deutsche Post,Frank Appel,CEO[43],2008,Previously with McKinsey & Co.,2017/11/14,,,,,,,????-1989,University of Munich,chemistry,,MSc,,????-1993,Swiss Federal Institute of Technology (ETH),neurobiology,,PhD,
Dickey's Barbecue Pit,Roland Dickey Jr.,CEO[44],2016,Grandson of the company founder.,2019/05/28,1992-1996,Southern Methodist University,"Business Administration and Management, General",,B.B.A.,,,,,,,,,,,,,
Dow Chemical Company,Edward D. Breen,CEO[45],2015,Previously CEO of Tyco International,2017/11/14,,,,,,,,,,,,,,,,,,
Dr. Reddy's,G. V. Prasad,Co-chairman and CEO[46],2001,Previously MD of Cheminor Drugs before it was acquired by Dr. Reddy's,2017/11/14,1980-1982,Illinois Institute of Technology,Chemical Engineering,,BS,,1982-1983,Purdue University,Management,,MSIA,,,,,,,
Eastman Kodak,Jeff Clarke,CEO[47],2014,Member of the boards of Autodesk and the State University of New York at Geneseo,2017/11/14,1979-1983,State University of New York College at Geneseo,Economics,,BA,"Geneseo Foundation, Board of Directors, 2006-2013",1983-1985,Northeastern University,,,MBA,"Trustee, 2013-Present",,,,,,
eBay,Devin Wenig,President and CEO[48],2015,"Third CEO of the company, after Meg Whitman and John Donahoe",2017/11/14,,Union College,,,BA,,,Columbia Law School,,,JD,,,,,,,
Electronic Arts,Andrew Wilson,CEO[49],2013,On the board for Intel,2017/11/14,,,,,,,,,,,,,,,,,,
Ericsson,Börje Ekholm,President and CEO[50],2017,"On the boards for the Alibaba Group, Nasdaq, Inc., Trimble, and the Royal Institute of Technology.",2017/11/14,,,,,,,1984-1988:::1989-1990,KTH Royal Institute of Technology:::INSEAD,Electrical Engineering:::,,MSC:::MBA,:::Dean's list,,,,,,
Exxon Mobil,Darren Woods,Chairman and CEO[51],2017,Replaces Rex Tillerson who became United States Secretary of State,2017/11/14,,Texas A&M University,electrical engineering,,BS,,,Northwestern University,,,MBA,,,,,,,
EY,Carmine Di Sibio,Global chairman and CEO[52],2019,Succeeded Mark Weinberger,2017/11/14,,Colgate University,Chemistry,,BA,,,New York University,,,MBA,,,,,,,
Facebook,Mark Zuckerberg,Chairman and CEO,2004,Co-founded Facebook in 2004,2017/11/14,,,,,,dropped out of Harvard where he studied psychology and computer science in his sophomore year in order to complete his project,,,,,,,,,,,,
FedEx,Frederick W. Smith,Chairman and CEO[53],1971,Founder of the company,2017/11/14,????-1966,Yale University,economics,,BA,,,,,,,,,,,,,
Fiat S.p.A.,Sergio Marchionne,CEO[54],2004,"Also chairman of CNH Industrial, Ferrari, Maserati, Chrysler and SGS S.A.",2017/11/14,,,,,,,,,,,,,,,,,,
Fidelity Investments,Abigail Johnson,"Chairman, president and CEO",2014,"Granddaughter of the firm's founder, Edward C. Johnson II",2017/11/14,????-1984,William Smith College,art history,,BA,,,Harvard Business School,,,MBA,,,,,,,
Fine Hygienic Holding,James Michael Lafferty,"Chief Executive Officer, Member Board of Directors",2018,"Former regional CEO for P&G, Coca-Cola, and BAT",2021/02/05,????-1985,University of Cincinnati,"psychology, physiology",,,,,,,,,,,,,,,
Ford Motor Company,James Hackett,President and CEO[55],2017,"Previously CEO of Steelcase, succeeded Mark Fields",2017/11/14,,University of Michigan,general studies,,BA,,,,,,,,,,,,,
Foxconn Electronics Inc,Terry Gou,Chairman and CEO[56],1974,Founder of the firm,2017/11/14,,,,,,,,,,,,,,,,,,
Fox Corporation,Lachlan Murdoch,Executive chairman and CEO,2019,Son of Rupert Murdoch,2020/03/05,,Princeton University,Philosophy,,,,,,,,,,,,,,,
FUBU,Daymond John,"Founder, president and CEO",1992,Also an investor on the American version of Shark Tank,2017/11/14,,,,,,,,,,,,,,,,,,
General Dynamics,Phebe Novakovic,Chairman and CEO[57],2014,Worked for the Central Intelligence Agency and the United States Department of Defense,2017/11/14,,Smith College,,,,,????-1988, Wharton School of the University of Pennsylvania,,,MBA,,,,,,,
General Electric,H. Lawrence Culp Jr.,Chairman and CEO,2018,"Prior to joining GE, Culp worked at Danaher Corporation in Washington, D.C.",2018/10/01,,Washington College,,,BA,,,Harvard Business School,,,MBA,,,,,,,
General Motors,Mary T. Barra,Chairman and CEO[58],2014,First female CEO of a major global automaker,2017/11/14,????-1985,Kettering University,electrical engineering,,BS,Kettering University used to be called General Motors Institute,????-1990,Stanford Graduate School of Business,,,MBA,,,,,,,
GlaxoSmithKline,Emma Walmsley,CEO[59],2017,Replaced Andrew Witty on his retirement,2017/11/13,,,,,,,,Oxford University,Classics and Modern Languages,,MA,,,,,,,
Goldman Sachs,David M. Solomon,CEO[60],2018,"Previously with Proskauer Rose and Donovan, Leisure, Newton & Irvine",2019/05/09,,Hamilton College,"political science, government",,,,,,,,,,,,,,,
Google,Sundar Pichai,CEO[61],2015,Former director of Jive Software from 2011 to 2013,2017/11/13,,IIT Kharagpur,metallurgical engineering,,Btech,,,Stanford University:::Wharton School of the University of Pennsylvania,materials science and engineering:::,,MS:::MBA,,,,,,,
GMA Network,Felipe Gozon,Chairman and CEO[62],2000,A member of the board since 1975,2017/11/13,????-1962,University of the Philippines,,,"A.A., LL.B.",,????-1965,Yale Law School,,,LL.M.,,,,,,,
GVK Group,Gunupati Venkata Krishna Reddy,Chairman and MD[63],1992,Founder of the firm,2017/11/13,,,,,,,,,,,,,,,,,,
HCL Technologies,C Vijayakumar,President and CEO[64],2016,"Joined the firm in 1994, previously the COO",2017/11/13,,PSG College of Technology,electrical & electronics engineering,,EEE,,,,,,,,,,,,,
Henderson Land Development,Lee Shau Kee,Chairman and MD[65],1976,"Founder of the firm, and one of the richest men in the world",2017/11/13,,,,,,,,,,,,,,,,,,
Hewlett Packard Enterprise,Antonio Neri,President and Chief Executive Officer[66],2015,25 years with HP,2021/04/11,,National Technological University,,,,,,,,,,,,,,,,
Honeywell,Darius Adamczyk,"Chairman, President, and CEO[67]",2017,Succeeded David M. Cote (now the executive chairman),2017/11/13,,Michigan State University,electrical and computer engineering,,BS,,,Syracuse University:::Harvard Business School,computer engineering:::,,MS:::MBA,,,,,,,
HP Hood LLC,John A. Kaneb,"Chairman, president and CEO[68]",1995,Acquired the firm in 1995 from Agway,2017/11/13,1952-1956,Harvard University,Economics,,BA,,,,,,,,,,,,,
HSBC,Noel Quinn,Group CEO[69],2019,Succeeded John Flint.,2017/11/13,????-1983,Birmingham City University,Accountancy,,BA,,,,,,,,,,,,,
IBM,Arvind Krishna,"Chairman, president and CEO[70]",2020,Succeeded Ginni Rometty.,2020/04/06,,,,,,,,,,,,,,,,,,
IMS Group,Dikesh Malhotra,President and CEO,2012,"Son of Founder and Chairman of IMS Group, Deepak Malhotra",2018/11/11,,,,,,,,,,,,,,,,,,
Infosys,Salil Parekh,Interim CEO and MD[71],2018,Previously on the board of Capgemini,2018/02/20,,,,,,,,,,,,,,,,,,
Intel,Pat Gelsinger,CEO[72],2021,Replaced Robert H. Swan,2021/03/22,,,,,,,,,,,,,,,,,,
InterCall,Scott Etzler,President and CEO,1999,Also serves on the board of Steppenwolf Theater Company[73],2017/11/13,,,,,,,,,,,,,,,,,,
J.Crew,Millard Drexler,CEO[74],2017,"Previously with West Elm, J. C. Penney, May Company, Anthropologie, and Urban Outfitters",2017/11/13,,,,,,,,,,,,,,,,,,
Jefferies Group,Richard B. Handler,Chairman and CEO[75],2001,Longest tenured CEO of a major Wall Street firm,2017/11/13,,,,,,,,,,,,,,,,,,
JP Morgan Chase,James Dimon,Chairman and CEO[76],2004,Also on the board of the New York Federal Reserve,2017/11/13,,,,,,,,,,,,,,,,,,
"Kaplan, Inc.",Andrew S. Rosen,Chairman and CEO[77],2002,Previously with The Washington Post and Newsweek,2017/11/13,,,,,,,,,,,,,,,,,,
KLM Royal Dutch Airlines,Pieter Elbers,CEO & President,2000,Previously CEO of Transavia france,,,,,,,,,,,,,,,,,,,
Koch Industries Inc.,Charles G. Koch,Chairman and CEO[78],1967,Son of co-founder Fred C. Koch,2017/11/13,,,,,,,,,,,,,,,,,,
Land Securities,Robert Noel,CEO[79],2012,Succeeded Francis Salway,2017/11/13,,,,,,,,,,,,,,,,,,
Las Vegas Sands,Sheldon Adelson,Chairman and CEO[80],1988,Founder of the Adelson Foundation,2017/11/13,,,,,,,,,,,,,,,,,,
L Brands,Les Wexner,"Founder, chairman and CEO",1963,Founder of the firm,2018/02/02,,,,,,,,,,,,,,,,,,
Lockheed Martin,Marillyn Hewson,"Chairman, president and CEO[81]",2013,Also serves on the board of Sandia National Laboratories and DuPont,2017/11/13,,,,,,,,,,,,,,,,,,
Marks and Spencer,Steve Rowe,CEO[82],2016,"Joined the firm in 1989, previously executive director of General Merchandise",2017/11/13,,,,,,,,,,,,,,,,,,
MasterCard,Ajaypal Singh Banga,CEO,1997,Joined the firm in 1997,2019/03/17,,,,,,,,,,,,,,,,,,
McDonald's,Chris Kempczinski,President and CEO[83],2019,With the company since 2014,2017/11/13,,,,,,,,,,,,,,,,,,
McKinsey,Kevin Sneader,Global managing partner[84],2009,Succeeded Ian Davis,2017/11/13,,,,,,,,,,,,,,,,,,
Mesa Air Group,Jonathan Ornstein,Chairman and CEO[85],1998,Formerly led Virgin Express and Continental Express,2017/11/13,,,,,,,,,,,,,,,,,,
MetLife,Steven A. Kandarian,"Chairman, president and CEO[86]",2011,Previously executive director for Pension Benefit Guaranty Corporation,2017/11/13,,,,,,,,,,,,,,,,,,
MGA Entertainment,Isaac Larian,CEO,1979,Co-founded the company,2017/11/13,,,,,,,,,,,,,,,,,,
Microsoft,Satya Nadella,CEO[87],2014,Was executive vice president of Microsoft's Cloud and Enterprise group,2017/11/13,,,,,,,,,,,,,,,,,,
MicroStrategy,Michael J. Saylor,Chairman and CEO[88],1989,Founder of the firm,2018/02/08,,,,,,,,,,,,,,,,,,
Morgan Stanley,James P. Gorman,Chairman and CEO[89],2010,Formerly with Merrill Lynch,2017/11/13,,,,,,,,,,,,,,,,,,
Mossy Oak,Toxey Haas,Founder and CEO[90],1986,Founder of the firm,2017/11/13,,,,,,,,,,,,,,,,,,
Mozilla Corporation,Chris Beard,CEO[91],2014,Previously CFO,2017/11/13,,,,,,,,,,,,,,,,,,
National Amusements,Sumner Redstone,Chairman and CEO[92],1967,Formerly executive chairman of CBS and Viacom,2017/11/12,,,,,,,,,,,,,,,,,,
NBCUniversal,Jeff Shell,CEO[93],2020,Previously was Chairman of NBCUniversal Film and Entertainment,2020/03/02,,,,,,,,,,,,,,,,,,
News Corp,Robert James Thomson,CEO[94],2013,Previously managing editor of The Wall Street Journal,2017/11/12,,,,,,,,,,,,,,,,,,
New York Times Company,Mark Thompson,President and CEO[95],2012,Succeeded Janet L. Robinson and was previously Director-General of the BBC,2017/11/12,,,,,,,,,,,,,,,,,,
NIIT,Vijay K. Thadani,Vice chairman and MD[96],1981,Co-founder,2017/11/12,,,,,,,,,,,,,,,,,,
Nike,Mark Parker,Chairman and CEO[97],2006,Third CEO of the company,2017/11/12,,,,,,,,,,,,,,,,,,
Nokia,Pekka Lundmark,President and CEO[98],2020,Previously President and CEO of Fortum,2020/08/16,,,,,,,,,,,,,,,,,,
Novartis,Vasant Narasimhan,CEO,2017,Former engineer for Public Service Enterprise Group,2017/11/12,,,,,,,,,,,,,,,,,,
Nintendo,Tatsumi Kimishima,Representative director and president[99],2015,Succeeded Satoru Iwata after his death,2017/11/12,,,,,,,,,,,,,,,,,,
Oath Inc.,Tim Armstrong,CEO[100],2009,"Oath is the parent to AOL, Armstrong was formerly with Google",2017/11/15,,,,,,,,,,,,,,,,,,
Oracle Corporation,Safra Catz,CEO[101],2014,Co-CEO following Larry Ellison,2017/11/12,,,,,,,,,,,,,,,,,,
Oracle Corporation,Mark Hurd,CEO[101],2014,Co-CEO following Larry Ellison; previously with Hewlett-Packard,2017/11/12,,,,,,,,,,,,,,,,,,
PepsiCo,Ramon Laguarta,CEO[102],2018,Succeeded Indra Nooyi who is still the Chairman until 2019.,2017-11-12[103],,,,,,,,,,,,,,,,,,
Pfizer,Albert Bourla,Chairman and CEO[104],01-Jan-19,Succeeded Jeff Kindler and Henry McKinnell,,,,,,,,,,,,,,,,,,,
Polo Ralph Lauren,Patrice Louvet,President and CEO[105],2017,Follows Stefan Larsson and Ralph Lauren,2017/11/12,,,,,,,,,,,,,,,,,,
Procter & Gamble,David S. Taylor,President and CEO[106],2015,Succeeded A.G. Lafley,2017/11/12,,,,,,,,,,,,,,,,,,
"Prudential Financial, Inc.",John Strangfeld,Chairman and CEO[107],2008,With the firm since 1977,2017/11/12,,,,,,,,,,,,,,,,,,
Qantas,Alan Joyce,CEO and MD[108],2008,Formerly with Aer Lingus and Ansett Australia,2017/11/12,,,,,,,,,,,,,,,,,,
Reliance Group,Anil Ambani,Chairman[109],2006,Son of founder Dhirubhai Ambani,2017/11/12,,,,,,,,,,,,,,,,,,
Reliance Industries Limited,Mukesh Ambani,Chairman and MD[110],2002,One of India's wealthiest people,2017/11/12,,,,,,,,,,,,,,,,,,
Renault,Luca de Meo,CEO[111],2005,Former CEO of Nissan,2017/11/12,,,,,,,,,,,,,,,,,,
Riovic,Phiwa Nkambule,CEO,2015,Previously founded Cybatar in 2014. Co-founded Riovic in 2015.,2018/07/19,,,,,,,,,,,,,,,,,,
Royal Bank of Canada,David I. McKay,President and CEO[112],2014,Succeeded Gordon Nixon,2017/11/12,,,,,,,,,,,,,,,,,,
Royal Bank of Scotland,Ross McEwan,CEO[113],2013,Succeeded Stephen Hester,2017/11/12,,,,,,,,,,,,,,,,,,
Royal Dutch Shell,Ben van Beurden,CEO[114],2014,"Joined Shell in 1983, succeeded Peter Voser",2017/11/12,,,,,,,,,,,,,,,,,,
Ryanair,Michael O'Leary,CEO[115],1994,One of Ireland's wealthiest businessmen,2017/11/12,,,,,,,,,,,,,,,,,,
S&P Global,Douglas L. Peterson,President & CEO,2013,,2018/10/01,,,,,,,,,,,,,,,,,,
S. C. Johnson & Son,Herbert Fisk Johnson III,Chairman and CEO[116],2004,Great-great grandson of company founder Samuel Curtis Johnson Sr.,2017/11/12,,,,,,,,,,,,,,,,,,
The Salvation Army,Brian Peddle,General and CEO[117],2018,Joined the organization in 1977,2018/08/13,,,,,,,,,,,,,,,,,,
Samsung,Oh-Hyun Kwon,Chairman and CEO[118],2012,Joined the firm in 1985,2017/11/12,,,,,,,,,,,,,,,,,,
SAP AG,Christian Klein,CEO[119],2019,Succeeding Bill McDermott in 2019,2019/11/18,,,,,,,,,,,,,,,,,,
SAS Institute,James Goodnight,CEO[120],1976,Founded the company after leaving North Carolina State University,2017/11/12,,,,,,,,,,,,,,,,,,
Schneider Electric,Jean-Pascal Tricoire,Chairman and CEO[121],2006,Replaced Henri Lachmann,2017/11/12,,,,,,,,,,,,,,,,,,
Siemens,Joe Kaeser,President and CEO[122],2013,Succeeds Peter Löscher,2017/11/12,,,,,,,,,,,,,,,,,,
Simon Property Group,David Simon,Chairman and CEO[123],1995,Son of founder and real estate developer Melvin Simon,2017/11/12,,,,,,,,,,,,,,,,,,
Singtel,Chua Sock Koong,Group CEO[124],2007,Joined the firm in 1989,2017/11/12,,,,,,,,,,,,,,,,,,
SoftBank,Masayoshi Son,Chairman and CEO[125],1981,"Founder of the firm, also chairman of Sprint Corporation",2017/11/12,,,,,,,,,,,,,,,,,,
Solera Holdings,Tony Aquila,Chairman and CEO[126],2005,Previously COO of Mitchell International,2017/11/12,,,,,,,,,,,,,,,,,,
Southwest Airlines,Gary C. Kelly,Chairman and CEO[127],2008,Replaced co-founder Herb Kelleher,2017/11/12,,,,,,,,,,,,,,,,,,
Sonic Corporation,J. Clifford Hudson,"Chairman, CEO and president[128]",1995,Also a trustee for the Ford Foundation,2017/11/12,,,,,,,,,,,,,,,,,,
